{
  "part1_overview": {
    "total_records": 535326,
    "province_count": 31,
    "year_min": 2000,
    "year_max": 2025,
    "cleaned_records": 534945,
    "missing_count": 165,
    "anomaly_notes": "剔除模式为空/N/A 行与年份<2000 行；人数缺失填0",
    "mode_distribution": {
      "3+X": 401189,
      "3+1+2": 70363,
      "3+3": 43238,
      "3+X+Y": 7316,
      "3+X+1": 5227,
      "3+学业水平测试+综合素质评价": 4232,
      "3+2": 2076,
      "3+1": 659,
      "3+文科/理科基础+X": 340,
      "3+1+1": 288,
      "3+大综合": 17
    }
  },
  "part2_reform_impact": {
    "province_analyzed": "河北",
    "selection_basis": "河北 2020→2021 由 3+X 干净切换至 3+1+2,切换点单一无过渡",
    "old_physics_liberal_ratio": 1.49,
    "new_physics_history_ratio": 1.07,
    "high_score_above_600_old": 31475,
    "high_score_above_600_new": 13411,
    "weighted_mean_old": 474.78,
    "weighted_mean_new": 471.57,
    "std_old": 106.06,
    "std_new": 88.58,
    "reform_direction": {
      "mean": "down",
      "std": "down",
      "high_score_share": "down"
    },
    "reform_timeline": {
      "2021": {
        "provinces": 8,
        "records": 8577
      },
      "2022": {
        "provinces": 8,
        "records": 8580
      },
      "2023": {
        "provinces": 8,
        "records": 8723
      },
      "2024": {
        "provinces": 15,
        "records": 17926
      },
      "2025": {
        "provinces": 23,
        "records": 26557
      }
    },
    "key_findings": "河北同口径下(理科→物理类)：均分与标准差均下降,高分段占比下降,表明新高考同科类分布更集中、极端高分收敛"
  },
  "part3_model": {
    "model_type": "RandomForestRegressor",
    "feature_count": 5,
    "feature_names": [
      "hist_mean",
      "hist_last",
      "hist_max",
      "prov_te",
      "hist_lag2"
    ],
    "train_size": 891,
    "test_size": 68,
    "test_years": [
      2024,
      2025
    ],
    "R2": 0.8595,
    "RMSE": 4259.01,
    "MAE": 2659.99,
    "top_features": [
      {
        "feature": "hist_mean",
        "importance": 0.6538
      },
      {
        "feature": "prov_te",
        "importance": 0.1362
      },
      {
        "feature": "hist_last",
        "importance": 0.0969
      },
      {
        "feature": "hist_lag2",
        "importance": 0.0586
      },
      {
        "feature": "hist_max",
        "importance": 0.0545
      }
    ]
  },
  "part4_causal": {
    "method": "DID + Synthetic Control + Placebo + Sensitivity + Parallel Trend",
    "treated_provinces": [
      "河北",
      "辽宁",
      "江苏",
      "福建",
      "湖北",
      "湖南",
      "广东",
      "重庆"
    ],
    "control_provinces": [
      "内蒙古",
      "北京",
      "吉林",
      "四川",
      "天津",
      "宁夏",
      "安徽",
      "山东",
      "山西",
      "广西",
      "新疆",
      "江西",
      "河南",
      "浙江",
      "甘肃",
      "贵州",
      "陕西",
      "青海",
      "黑龙江"
    ],
    "did_effect": 4209.5,
    "scm_effect": 4284.1,
    "placebo_time_effect": -11.6,
    "placebo_treat_effect": 2106.0,
    "sensitivity_min": 4209.5,
    "sensitivity_max": 4860.3,
    "consistency": true,
    "parallel_trend_diff": -654.7,
    "parallel_trend_pvalue": 0.8588
  },
  "part5_advanced": {
    "tail_index_method": "Hill / Peaks-over-Threshold EVT (threshold=600)",
    "tail_index_value": 0.0439,
    "panel_ols_coefs": {
      "intercept": {
        "coef": 8.2796,
        "se": 0.5326,
        "t": 15.55,
        "p": 0.0
      },
      "year": {
        "coef": -0.1314,
        "se": 0.0651,
        "t": -2.02,
        "p": 0.0435
      },
      "is_new": {
        "coef": 1.6328,
        "se": 0.4083,
        "t": 3.999,
        "p": 6.36e-05
      }
    },
    "distribution_distance": 37.24,
    "conformal_target_coverage": 0.8,
    "conformal_empirical_coverage": 0.8,
    "conformal_mean_width": 9395.9
  }
}